{
  "schema_version":"1.0.0-draft",
  "programme_id":"SU-REGULATION-OPENFDA-510K-v0.1",
  "status":"NONCANONICAL_PROGRAMME_CONTROL",
  "source_universe_id":"SU-REGULATION",
  "source_system":"OPENFDA_DEVICE_510K",
  "as_of":"2026-09-02",
  "provider_contract":{"provider":"U.S. FDA openFDA Device 510(k) API","endpoint":"https://api.fda.gov/device/510k.json","method":"GET","response_media_type":"application/json","source_dataset":"510(k) Clearances","time_period_start":"1976","provider_update_frequency":"MONTHLY","reported_denominator_path":"meta.results.total","skip_path":"meta.results.skip","limit_path":"meta.results.limit","results_path":"results","primary_submission_id_field":"k_number","max_records_per_request":1000,"max_skip":25000,"max_direct_result_count":26000,"provider_supports_search_after":true,"provider_supports_bulk_downloads":true,"configuration_performs_http":false},
  "workbench_dependency":{"minimum_package_line":"0.3.0.dev0","required_capability":"project_openfda_510k_pages","integration_state":"AVAILABLE"},
  "identity_policy":{"primary_identity":"K_NUMBER","admitted_prefixes":["K","BK"],"den_prefix_is_de_novo_and_out_of_scope_for_v0_1":true,"same_device_name_auto_merge":false,"same_applicant_auto_entity_merge":false,"product_code_auto_system_merge":false,"openfda_harmonized_fields_auto_identity_merge":false,"record_content_change_is_successor_observation_not_new_submission_identity":true,"conflicting_same_k_number_policy":"FAIL_CLOSED"},
  "decision_semantics_policy":{"recognized_substantial_equivalence_codes":["SEKD","SESD","SESE","SESK","SESP","SESU","SESR"],"recognized_state":"SUBSTANTIALLY_EQUIVALENT_RECORDED","unknown_or_missing_code_state":"UNRESOLVED_DECISION_CODE","description_only_inference_allowed":false,"device_name_or_record_presence_inference_allowed":false},
  "inclusion_policy":{"candidate_scope":"DECLARED_OPENFDA_510K_SEARCH_MATCH_WITH_K_OR_BK_PREFIX","automatic_source_admission":false,"automatic_system_or_device_entity_creation":false,"automatic_applicant_entity_creation":false,"automatic_predicate_relationship_creation":false,"automatic_clearance_claim_from_record_presence":false,"automatic_global_authorization_claim_creation":false,"automatic_safety_effectiveness_claim_creation":false,"automatic_system_conformance_claim_creation":false,"automatic_assessment_mutation":false,"automatic_reopening_decision":false,"automatic_monitor_creation":false,"human_relevance_review_required":true},
  "paging_policy":{"execution_mode_v0_1":"SKIP_LIMIT_BOUNDED","page_limit":1000,"initial_skip":0,"max_skip":25000,"max_direct_result_count":26000,"over_limit_policy":"SEARCH_AFTER_OR_DECISION_DATE_PARTITION_REQUIRED_BEFORE_MATERIALIZATION","preferred_partition_field":"decision_date","silent_truncation_allowed":false,"partial_over_limit_candidate_emission_allowed":false,"search_after_not_yet_authorized_by_v0_1_projector":true,"partition_provenance_required":true},
  "query_streams":[
    {"query_id":"DISCOVERY-OPENFDA-510K-BCI-001","search":"device_name:\"brain+computer+interface\"+OR+device_name:\"brain+machine+interface\"+OR+device_name:\"neural+interface\"","cadence":"MONTHLY","status":"ACTIVE","scope_tiers":["A"],"purpose":"510(k) submission/decision discovery for explicit BCI/neural-interface device names.","completeness_claim":false},
    {"query_id":"DISCOVERY-OPENFDA-510K-DBS-NEUROSTIM-001","search":"device_name:\"deep+brain+stimulator\"+OR+device_name:\"deep+brain+stimulation\"+OR+device_name:neurostimulator","cadence":"MONTHLY","status":"ACTIVE","scope_tiers":["A","B"],"purpose":"510(k) submission/decision discovery for DBS and neurostimulator device names.","completeness_claim":false},
    {"query_id":"DISCOVERY-OPENFDA-510K-NEUROPROSTHESIS-001","search":"device_name:neuroprosthesis+OR+device_name:\"neural+prosthesis\"+OR+device_name:\"brain+prosthesis\"","cadence":"MONTHLY","status":"ACTIVE","scope_tiers":["A","B"],"purpose":"510(k) submission/decision discovery for neuroprosthetic device names.","completeness_claim":false},
    {"query_id":"DISCOVERY-OPENFDA-510K-VISUAL-NEUROPROSTHESIS-001","search":"device_name:\"retinal+prosthesis\"+OR+device_name:\"retinal+implant\"+OR+device_name:\"visual+prosthesis\"","cadence":"MONTHLY","status":"ACTIVE","scope_tiers":["A","B"],"purpose":"510(k) submission/decision discovery for retinal and visual prosthetic device names.","completeness_claim":false},
    {"query_id":"DISCOVERY-OPENFDA-510K-NEURAL-RECORDING-001","search":"device_name:\"intracortical+electrode\"+OR+device_name:\"brain+electrode\"+OR+device_name:electrocorticography","cadence":"MONTHLY","status":"ACTIVE","scope_tiers":["A","B"],"purpose":"510(k) submission/decision discovery for invasive neural-recording device names.","completeness_claim":false}
  ],
  "candidate_projection":{"required_fields":["k_number","device_name","applicant","date_received","decision_date","decision_code","decision_description","clearance_type","product_code","statement_or_summary","expedited_review_flag","third_party_flag","decision_semantics","decision_supports_substantial_equivalence","decision_code_recognized","query_memberships","normalized_record_sha256"],"address_or_contact_fields_in_discovery_layer":false,"raw_api_pages_emitted_to_s2":false,"den_records_emitted_as_510k_candidates":false,"substantial_equivalence_or_clearance_state_derived_only_from_decision_fields":true},
  "coverage_contract":{"required_metrics_per_leaf_query":["supplied_page_count","returned_record_count","unique_k_number_count","reported_total_count","reported_total_count_state","skip_sequence_valid","skip_coverage_state","over_26000_limit","search_after_or_partition_required","out_of_scope_den_count","known_controlled_duplicate_count","new_candidate_count","duplicate_representation_count","unresolved_k_number_count"],"mechanical_completion_requires":{"reported_total_count_state":"CONSISTENT","skip_sequence_valid":true,"skip_coverage_state":"MATCH","over_26000_limit":false,"search_after_or_partition_required":false},"device_510k_database_completeness_claim":false,"global_neuroai_510k_coverage_claim":false,"query_recall_claim":false,"record_presence_is_clearance_claim":false,"clearance_is_pma_approval_claim":false,"clearance_is_global_authorization_claim":false,"clearance_is_all_configuration_conformance_claim":false},
  "human_review_contract":{"required_dispositions":["ACCEPT","REJECT","DEFER","EXCLUDE"],"automatic_acceptance":false,"record_presence_is_clearance_evidence":false,"clearance_record_is_pma_approval":false,"clearance_record_is_global_authorization":false,"clearance_record_is_full_clinical_effectiveness_determination":false,"clearance_record_is_all_configuration_conformance_evidence":false,"clearance_record_automatically_reopens_assessment":false},
  "network_policy":{"live_execution":"OPT_IN_ONLY","requires_workbench_network_gate":true,"configuration_performs_http":false,"hosted_success_claim_allowed_without_runner_steps":false},
  "boundary":"This programme discovers FDA 510(k) submission/decision records with K/BK identifiers. Substantial-equivalence semantics are recognized only for the exact FDA decision-code allowlist. Record presence, descriptions, device names or applicant data do not independently create a clearance claim. Even a substantially-equivalent record does not establish PMA approval, global authorization, complete clinical effectiveness, exact identity of every commercial configuration, system-wide conformance or automatic assessment reopening. DEN-prefixed De Novo records are out of scope and require a separate programme."
}
